{
  "slug": "driveway-sealcoating",
  "businessName": "Blackline Sealcoating",
  "niche": "driveway sealcoating service",
  "layoutVariant": "surface-seasonal",
  "pattern": {
    "primaryPattern": "seasonal-readiness-estimate",
    "secondaryPattern": "weather-window-proof",
    "silhouette": "split-quote-board",
    "navigationPrimitive": "compact-header",
    "mobileActionPattern": "inline-estimate-actions",
    "imageRole": "work-in-progress",
    "imageEvidence": "seasonal surface restoration in progress",
    "ctaRhythm": "quote-first",
    "surfaceFamily": "dark-panel",
    "surfaceModel": "dark-panel-prep-cards",
    "styleFamily": "operator-console",
    "density": "balanced-editorial",
    "colorRoles": {
      "ink": "deepGreen",
      "paper": "cream",
      "field": "mist",
      "line": "soil",
      "primary": "grass",
      "action": "sun",
      "proof": "leaf",
      "muted": "soil",
      "warning": "sun",
      "shadowTint": "deepGreen"
    },
    "geometry": {
      "radiusScale": "industrial-6",
      "borderRole": "dark-panel contrast lines",
      "shadowRole": "hero media lift only",
      "mediaCrop": "wide surface-action crop"
    },
    "coreBlockPlan": [
      "columns",
      "image",
      "table",
      "buttons",
      "list"
    ],
    "knownRisks": [
      "dark-hero-contrast",
      "weather-window-cta-buried",
      "asphalt-palette-too-flat"
    ],
    "styleContract": "Bold seasonal and street-readable with weather-window proof, fresh sealcoat action imagery, yellow action accents, and a readiness badge strip as the signature move."
  },
  "tagline": "Fresh blacktop with clean edges and no driveway drama.",
  "themeSlug": "twentytwentyfive",
  "landingPage": "/",
  "palette": {
    "grass": "#916000",
    "deepGreen": "#15191c",
    "leaf": "#6f7c6d",
    "sun": "#ffd166",
    "cream": "#f7f2e7",
    "mist": "#e3e7e2",
    "soil": "#3f4444",
    "white": "#ffffff"
  },
  "assets": {
    "hero": "assets/driveway-sealcoating/blacktop-hero.jpg",
    "logo": "assets/driveway-sealcoating/blackline-logo.png",
    "favicon": "assets/driveway-sealcoating/blackline-favicon.png"
  },
  "assetMeta": {
    "hero": {
      "title": "Blackline driveway sealcoating hero image",
      "alt": "A driveway sealcoating worker applying a fresh black sealcoat beside an unsealed cracked asphalt section."
    }
  },
  "contact": {
    "phoneLabel": "(555) 014-7730",
    "phoneHref": "tel:+15550147730",
    "email": "quotes@blackline.example.com",
    "emailHref": "mailto:quotes@blackline.example.com",
    "serviceArea": "Residential asphalt driveways, private lanes, and small parking pads across the west suburbs, lake roads, and nearby townships"
  },
  "copy": {
    "eyebrow": "Driveway sealcoating timed for real weather",
    "heroTitle": "Fresh blacktop. Sharp edges.",
    "heroText": "Blackline cleans, fills small cracks, and seals tired asphalt with tidy passes that make your driveway look cared for before the next rain gets ideas.",
    "primaryCta": "Get a driveway quote",
    "secondaryCta": "Check sealing weather",
    "introTitle": "Sealcoating is half timing, half prep.",
    "introText": "We look at surface condition, temperature, cure time, and edges so the finish lands smooth instead of rushed.",
    "servicesTitle": "What we check before the coat",
    "processTitle": "How the blackline goes down",
    "proofTitle": "Good sealing windows",
    "quoteTitle": "Ready for the satisfying blacktop reset?",
    "quoteText": "Request a quote with driveway photos, rough dimensions, crack trouble spots, and the last time it was sealed. We will reply with timing, prep notes, and a clear estimate."
  },
  "services": [
    {
      "title": "Crack and edge read",
      "text": "We flag small cracks, crumbly edges, oil spots, and drainage spots before promising a glossy finish."
    },
    {
      "title": "Clean-and-prime prep",
      "text": "Loose grit, weeds, and stains get handled so the sealcoat grips the driveway instead of skating over dirt."
    },
    {
      "title": "Tidy sealcoat pass",
      "text": "Squeegee application, careful borders, and taped transitions keep the blacktop sharp without painting the sidewalk."
    }
  ],
  "process": [
    {
      "title": "Send the driveway",
      "text": "A wide photo, a crack close-up, and rough dimensions are enough to start a real estimate."
    },
    {
      "title": "Pick the weather window",
      "text": "We line up the job around dry pavement, friendly temperatures, and cure time that will not ruin your plans."
    },
    {
      "title": "Seal, edge, and rope off",
      "text": "We prep, apply, clean the borders, and leave simple keep-off notes so the finish cures clean."
    }
  ],
  "proof": [
    {
      "stat": "70-90F",
      "label": "favorite sealcoat temperature range"
    },
    {
      "stat": "24-48hr",
      "label": "typical keep-off cure window"
    },
    {
      "stat": "Clean edge",
      "label": "garage, walkway, and curb transitions"
    }
  ],
  "release": {
    "status": "approved",
    "reviewedAt": "2026-06-25",
    "visualBaseline": "pending",
    "reviewChecklist": {
      "firstViewportClear": true,
      "logoReadable": true,
      "layoutDistinct": true,
      "ctaClear": true,
      "copySpecific": true,
      "noImageArtifacts": true,
      "heroArtDirected": true,
      "hierarchyDistinct": true,
      "signatureMove": true,
      "restrainedComposition": true,
      "screenshotCompared": true
    },
    "premiumReview": {
      "version": 2,
      "reviewedAt": "2026-06-25",
      "score": 100,
      "categories": {
        "firstViewport": true,
        "logoScale": true,
        "typography": true,
        "polishContract": true,
        "imageProof": true,
        "ctaClarity": true,
        "mobilePolish": true,
        "layoutDistinctness": true,
        "copySpecificity": true,
        "assetQa": true,
        "brandBrief": true
      },
      "notes": [
        "Works: a readiness badge strip. gives the page a memorable shape.",
        "Proof: seasonal surface restoration in progress. anchors the niche in the first viewport.",
        "Action: Get a driveway quote is the main conversion path."
      ]
    }
  },
  "brandBrief": {
    "mood": "Bold seasonal and street-readable.",
    "trustCue": "weather-window proof.",
    "accentBehavior": "sun stays reserved for Get a driveway quote, active proof cues, and key booking moments.",
    "imageProof": "seasonal surface restoration in progress.",
    "signatureMove": "a readiness badge strip.",
    "avoidLookingLike": "Avoid a generic surface-seasonal recolor; do not repeat stock hero framing, copied card rhythm, or vague local-service claims."
  },
  "serviceDetails": {
    "turnaround": "70-90F: favorite sealcoat temperature range.",
    "whatToSend": "Send photos from the ground, access notes, weather or date constraints, and the warning signs you noticed so the visit starts safely.",
    "prepNote": "A wide photo, a crack close-up, and rough dimensions are enough to start a real estimate.",
    "serviceRhythm": "Risk-check flow for Residential asphalt driveways, private lanes, and small parking pads across the west suburbs, lake roads, and nearby townships: photos, weather, access, and no-go conditions shape the safe visit plan.",
    "objectionAnswer": "For driveway sealcoating service, surface photos, crack edges, shade timing, and cure-window weather decide the quote, so the plan names what can be sealed now and what should wait."
  }
}
