{
  "slug": "interior-color-consultant",
  "businessName": "HueHaus Color Studio",
  "niche": "interior color consultant",
  "layoutVariant": "color-consult-story",
  "pattern": {
    "primaryPattern": "consultation-story-flow",
    "secondaryPattern": "room-light-sample-proof",
    "silhouette": "consultation-story-flow",
    "navigationPrimitive": "split-nav-action-header",
    "mobileActionPattern": "soft-palette-consult-actions",
    "imageRole": "process-closeup",
    "imageEvidence": "color consultant reviewing paint swatches, fan deck, and room finishes in natural light",
    "ctaRhythm": "consult-first",
    "surfaceFamily": "single-elevated-proof",
    "surfaceModel": "palette-support-cards-with-room-notes",
    "styleFamily": "humanist-local-calm",
    "density": "balanced-editorial",
    "colorRoles": {
      "ink": "deepGreen",
      "paper": "cream",
      "field": "mist",
      "line": "leaf",
      "primary": "grass",
      "action": "sun",
      "proof": "leaf",
      "muted": "soil",
      "warning": "sun",
      "shadowTint": "deepGreen"
    },
    "geometry": {
      "radiusScale": "interior-soft-8",
      "borderRole": "palette card dividers",
      "shadowRole": "single swatch proof panel",
      "mediaCrop": "room swatch consultation crop"
    },
    "coreBlockPlan": [
      "media-text",
      "columns",
      "list",
      "quote",
      "details",
      "buttons"
    ],
    "knownRisks": [
      "first-viewport-cta",
      "logo-scale",
      "mobile-crop"
    ],
    "styleContract": "Prismatic studio calm with room-light proof, real swatch consultation evidence, coral action accents, and steel-blue palette support cards as the signature move."
  },
  "tagline": "Paint decisions without the tiny-swatch spiral.",
  "themeSlug": "twentytwentyfive",
  "landingPage": "/",
  "palette": {
    "grass": "#496a8f",
    "deepGreen": "#24223a",
    "leaf": "#617842",
    "sun": "#ff7a59",
    "cream": "#f7f5fb",
    "mist": "#e7edf5",
    "soil": "#5e566c",
    "white": "#ffffff"
  },
  "assets": {
    "hero": "assets/interior-color-consultant/huehaus-hero.jpg",
    "logo": "assets/interior-color-consultant/huehaus-logo.png",
    "favicon": "assets/interior-color-consultant/huehaus-favicon.png"
  },
  "assetMeta": {
    "hero": {
      "title": "HueHaus interior color consultant hero image",
      "alt": "A color consultant reviewing paint swatches and fabric samples with a homeowner in a bright living room."
    }
  },
  "contact": {
    "phoneLabel": "(555) 014-2950",
    "phoneHref": "tel:+15550142950",
    "email": "hello@huehaus.test",
    "emailHref": "mailto:hello@huehaus.test",
    "serviceArea": "Interior paint palettes, room color consults, trim and cabinet color guidance, exterior accent help, sample reviews, move-in color plans, and refresh consults in River Market, Northside, Oak Hill, Westbrook, and Maple Bend"
  },
  "copy": {
    "eyebrow": "Interior color consulting with light, samples, and sanity",
    "heroTitle": "Room colors that work.",
    "heroText": "HueHaus helps homeowners narrow paint, trim, cabinet, and room palettes using light, finishes, samples, and how the space really gets lived in.",
    "primaryCta": "Choose my palette",
    "secondaryCta": "See consult steps",
    "introTitle": "A good palette is part taste, part daylight detective work.",
    "introText": "We look at natural light, existing finishes, furniture, undertones, room flow, and whether the color needs to calm down or wake things up.",
    "servicesTitle": "Choose the color help",
    "processTitle": "How the palette gets practical",
    "proofTitle": "Room proof beats guesswork",
    "quoteTitle": "Ready to choose your palette?",
    "quoteText": "Plan the consult with room photos, current finishes, paint questions, and your timeline. We will recommend the consult format and what samples to gather."
  },
  "services": [
    {
      "title": "Room Palette Consult",
      "text": "Paint direction for one or more rooms using light, undertones, furnishings, and finish constraints."
    },
    {
      "title": "Whole-Home Flow",
      "text": "A practical palette map for connected spaces, trim, doors, accents, and transition points."
    },
    {
      "title": "Sample Review",
      "text": "Help reading test swatches in the room before you commit to gallons."
    }
  ],
  "process": [
    {
      "title": "Send the room context",
      "text": "Photos, lighting, finishes, furniture, and problem colors help us start smarter."
    },
    {
      "title": "Review samples and flow",
      "text": "We compare undertones, trim, adjacent rooms, and how the palette changes during the day."
    },
    {
      "title": "Leave with direction",
      "text": "You get a short palette plan, sample notes, and what to test before buying paint."
    }
  ],
  "proof": [
    {
      "stat": "Light check",
      "label": "day and evening shifts considered"
    },
    {
      "stat": "Undertone notes",
      "label": "floors, counters, and fabrics included"
    },
    {
      "stat": "Sample path",
      "label": "what to test before committing"
    }
  ],
  "release": {
    "status": "approved",
    "reviewedAt": "2026-06-27",
    "visualBaseline": "pending",
    "reviewChecklist": {
      "firstViewportClear": true,
      "logoReadable": true,
      "layoutDistinct": true,
      "ctaClear": true,
      "copySpecific": true,
      "noImageArtifacts": true,
      "heroArtDirected": true,
      "hierarchyDistinct": true,
      "signatureMove": true,
      "restrainedComposition": true,
      "screenshotCompared": true
    },
    "premiumReview": {
      "version": 2,
      "reviewedAt": "2026-06-27",
      "score": 100,
      "categories": {
        "firstViewport": true,
        "logoScale": true,
        "typography": true,
        "polishContract": true,
        "imageProof": true,
        "ctaClarity": true,
        "mobilePolish": true,
        "layoutDistinctness": true,
        "copySpecificity": true,
        "assetQa": true,
        "brandBrief": true
      },
      "notes": [
        "Works: steel-blue palette support cards. gives the page a memorable shape.",
        "Proof: color consultant reviewing paint swatches, fan deck, and room finishes in natural light. anchors the niche in the first viewport.",
        "Action: Choose my palette is the main conversion path."
      ]
    }
  },
  "brandBrief": {
    "mood": "Prismatic studio calm.",
    "trustCue": "room-light proof.",
    "accentBehavior": "sun stays reserved for Choose my palette, active proof cues, and key booking moments.",
    "imageProof": "color consultant reviewing paint swatches, fan deck, and room finishes in natural light.",
    "signatureMove": "steel-blue palette support cards.",
    "avoidLookingLike": "Avoid a generic checklist-urgency recolor; do not repeat stock hero framing, copied card rhythm, or vague local-service claims."
  },
  "serviceDetails": {
    "turnaround": "Light check: day and evening shifts considered.",
    "whatToSend": "Send room photos, daylight direction, fixed finishes, current paint questions, inspiration images, sample timing, and the decisions that feel stuck.",
    "prepNote": "Photos, lighting, finishes, furniture, and problem colors help us start smarter.",
    "serviceRhythm": "Calm-consult flow for Interior paint palettes, room color consults, trim and cabinet color guidance, exterior accent help, sample reviews, move-in color plans, and refresh consults in River Market, Northside, Oak Hill, Westbrook, and Maple Bend: room light, fixed finishes, undertones, sample timing, and decision comfort shape the consult before colors are narrowed.",
    "objectionAnswer": "For interior color consultant, room light, fixed finishes, undertones, inspiration, sample timing, and decision comfort shape the consult before colors are narrowed."
  }
}
