{
  "slug": "holiday-light-installation",
  "businessName": "RidgeGlow Holiday Lights",
  "niche": "holiday light installation service",
  "layoutVariant": "urgent-checklist",
  "pattern": {
    "primaryPattern": "date-window-reservation",
    "secondaryPattern": "checklist-safety-date-proof",
    "silhouette": "viewport-safe-conversion-shell",
    "navigationPrimitive": "viewport-safe-hero-shell",
    "mobileActionPattern": "date-check-actions",
    "imageRole": "environment-context",
    "imageEvidence": "seasonal work in progress with safety context",
    "ctaRhythm": "date-check",
    "surfaceFamily": "receipt-stack",
    "surfaceModel": "date-board-checklist-cards",
    "styleFamily": "editorial-proof-stage",
    "density": "balanced-editorial",
    "colorRoles": {
      "ink": "deepGreen",
      "paper": "cream",
      "field": "mist",
      "line": "soil",
      "primary": "grass",
      "action": "sun",
      "proof": "leaf",
      "muted": "soil",
      "warning": "grass",
      "shadowTint": "deepGreen"
    },
    "geometry": {
      "radiusScale": "utility-6",
      "borderRole": "date checklist dividers",
      "shadowRole": "date board and hero media",
      "mediaCrop": "seasonal action crop"
    },
    "coreBlockPlan": [
      "columns",
      "image",
      "details",
      "buttons"
    ],
    "knownRisks": [
      "seasonal-urgency-too-loud",
      "dark-hero-contrast",
      "date-board-pushes-cta"
    ],
    "styleContract": "Black-cherry seasonal urgency with warmer editorial proof staging, ladder-safety evidence, restrained warm-light action accents, and a reserve-date board as the signature move."
  },
  "tagline": "Roofline lights installed before the cold gets bossy.",
  "themeSlug": "twentytwentyfive",
  "landingPage": "/",
  "palette": {
    "grass": "#b92e35",
    "deepGreen": "#35111d",
    "leaf": "#245f4d",
    "sun": "#ffd34d",
    "cream": "#fff8ec",
    "mist": "#f4e8e1",
    "soil": "#6b5660",
    "white": "#ffffff"
  },
  "assets": {
    "hero": "assets/holiday-light-installation/ridgeglow-hero.jpg",
    "logo": "assets/holiday-light-installation/ridgeglow-logo.png",
    "favicon": "assets/holiday-light-installation/ridgeglow-favicon.png"
  },
  "assetMeta": {
    "hero": {
      "title": "RidgeGlow holiday light installation hero image",
      "alt": "Two holiday light installers safely placing warm white roofline lights on a suburban home at blue-hour dusk."
    }
  },
  "contact": {
    "phoneLabel": "(555) 014-1225",
    "phoneHref": "tel:+15550141225",
    "email": "hello@ridgeglow.example.com",
    "emailHref": "mailto:hello@ridgeglow.example.com",
    "serviceArea": "Holiday roofline lights, porch columns, wreaths, timers, removal, and labeled storage for homes across the north suburbs, lake neighborhoods, and nearby cul-de-sacs"
  },
  "copy": {
    "eyebrow": "Holiday lights with clip-safe roofline planning",
    "heroTitle": "Reserve the roofline slot.",
    "heroText": "RidgeGlow maps rooflines, clips, outlets, timers, ladder access, install week, and takedown labels before the first strand goes up.",
    "primaryCta": "Check dates",
    "secondaryCta": "View glow levels",
    "introTitle": "Reserve dates, clips, timers, and takedown in one plan.",
    "introText": "We plan the line, power access, timer location, ladder approach, clip style, removal date, and storage labels before the first strand goes up.",
    "servicesTitle": "Pick the glow level",
    "processTitle": "How the season stays safe",
    "proofTitle": "Date and ladder checks before the glow",
    "quoteTitle": "Ready to hold your install week?",
    "quoteText": "Send a front-of-house photo, roofline wish list, outlet notes, and ideal install week. We reply with available dates, ladder notes, clip plan, and removal timing."
  },
  "services": [
    {
      "title": "Warm White Roofline",
      "text": "Straight, classic roofline lights with clean clips, power planning, timer setup, and a final dusk check before the ladder leaves."
    },
    {
      "title": "Classic Plus Accents",
      "text": "Roofline lighting plus porch columns, wreaths, small trees, or garage trim for homes that want a little more sparkle without going full parade float."
    },
    {
      "title": "Removal And Storage",
      "text": "Post-season takedown, strand check, clip sorting, and labeled storage notes so next year starts with fewer tangled mysteries."
    }
  ],
  "process": [
    {
      "title": "Send the roofline",
      "text": "A wide front photo, power outlet notes, steep areas, and the style you like help us build a real date and ladder plan."
    },
    {
      "title": "Install with a checklist",
      "text": "The crew checks clips, ladder placement, cords, timers, roof edges, and the final run before turning the glow on."
    },
    {
      "title": "Remove and label",
      "text": "After the season, we remove strands cleanly, check for repairs, and label storage so next winter does not start in a knot."
    }
  ],
  "proof": [
    {
      "stat": "Oct-Nov",
      "label": "best install window before weather gets rude"
    },
    {
      "stat": "Clip-safe",
      "label": "roofline planning without staple scars"
    },
    {
      "stat": "Labeled",
      "label": "removal and storage notes for next season"
    }
  ],
  "release": {
    "status": "approved",
    "reviewedAt": "2026-06-25",
    "visualBaseline": "pending",
    "reviewChecklist": {
      "firstViewportClear": true,
      "logoReadable": true,
      "layoutDistinct": true,
      "ctaClear": true,
      "copySpecific": true,
      "noImageArtifacts": true,
      "heroArtDirected": true,
      "hierarchyDistinct": true,
      "signatureMove": true,
      "restrainedComposition": true,
      "screenshotCompared": true
    },
    "premiumReview": {
      "version": 2,
      "reviewedAt": "2026-06-25",
      "score": 100,
      "categories": {
        "firstViewport": true,
        "logoScale": true,
        "typography": true,
        "polishContract": true,
        "imageProof": true,
        "ctaClarity": true,
        "mobilePolish": true,
        "layoutDistinctness": true,
        "copySpecificity": true,
        "assetQa": true,
        "brandBrief": true
      },
      "notes": [
        "Works: a reserve-date board. gives the page a memorable shape.",
        "Proof: seasonal work in progress with safety context. anchors the niche in the first viewport.",
        "Action: Check dates is the main conversion path."
      ]
    }
  },
  "brandBrief": {
    "mood": "Black-cherry seasonal urgency.",
    "trustCue": "warmer editorial proof staging.",
    "accentBehavior": "sun stays reserved for Check dates, active proof cues, and key booking moments.",
    "imageProof": "seasonal work in progress with safety context.",
    "signatureMove": "a reserve-date board.",
    "avoidLookingLike": "Avoid a generic urgent-checklist recolor; do not repeat stock hero framing, copied card rhythm, or vague local-service claims."
  },
  "serviceDetails": {
    "turnaround": "Oct-Nov: best install window before weather gets rude.",
    "whatToSend": "Send photos from the ground, access notes, weather or date constraints, and the warning signs you noticed so the visit starts safely.",
    "prepNote": "A wide front photo, power outlet notes, steep areas, and the style you like help us build a real date and ladder plan.",
    "serviceRhythm": "Risk-check flow for Holiday roofline lights, porch columns, wreaths, timers, removal, and labeled storage for homes across the north suburbs, lake neighborhoods, and nearby cul-de-sacs: photos, weather, access, and no-go conditions shape the safe visit plan.",
    "objectionAnswer": "For holiday light installation service, roofline photos, outlet locations, ladder reach, timers, and takedown timing shape the plan before a date is promised."
  }
}
